platform/android/app/src/main/assets/navigation_route.json

{
  "schemaVersion": 1,
  "routeId": "valhalla-0",
  "family": "profile_optimal",
  "distanceM": 3174,
  "durationS": 242.149,
  "engineName": "valhalla",
  "engineVersion": "3.8.3",
  "segmentDataStatus": "complete",
  "geometry": [
    [47.140931999999999, 9.5208770000000005],
    [47.140929999999997, 9.5208919999999999],
    [47.140931000000002, 9.5209340000000005],
    [47.140940000000001, 9.5209709999999994],
    [47.140956000000003, 9.5210059999999999],
    [47.140974, 9.5210340000000002],
    [47.141008999999997, 9.5210690000000007],
    [47.141043000000003, 9.5210830000000009],
    [47.141061000000001, 9.5210849999999994],
    [47.141077000000003, 9.5210790000000003],
    [47.141100999999999, 9.5210589999999993],
    [47.141120000000001, 9.5210319999999999],
    [47.141128000000002, 9.5210129999999999],
    [47.141171999999997, 9.5209899999999994],
    [47.141201000000002, 9.5209670000000006],
    [47.141235999999999, 9.5209360000000007],
    [47.141275999999998, 9.5208619999999993],
    [47.141331999999998, 9.5207949999999997],
    [47.141396999999998, 9.5207189999999997],
    [47.141494999999999, 9.5206],
    [47.141613999999997, 9.5204699999999995],
    [47.141711999999998, 9.520365],
    [47.141840000000002, 9.5202249999999999],
    [47.141908000000001, 9.5201460000000004],
    [47.141981000000001, 9.5200499999999995],
    [47.142052, 9.5199490000000004],
    [47.142195000000001, 9.5197500000000002],
    [47.142353999999997, 9.5195360000000004],
    [47.142566000000002, 9.5192460000000008],
    [47.142665000000001, 9.5191219999999994],
    [47.142851999999998, 9.5188880000000005],
    [47.142947999999997, 9.5187589999999993],
    [47.143003, 9.5186799999999998],
    [47.143023999999997, 9.5186489999999999],
    [47.143056000000001, 9.5185980000000008],
    [47.143124999999998, 9.5184829999999998],
    [47.143239999999999, 9.5182859999999998],
    [47.143349999999998, 9.5180959999999999],
    [47.143535999999997, 9.5177759999999996],
    [47.143599999999999, 9.5176680000000005],
    [47.143762000000002, 9.5174050000000001],
    [47.143909999999998, 9.5171650000000003],
    [47.143982999999999, 9.5170440000000003],
    [47.144055999999999, 9.5169180000000004],
    [47.144167000000003, 9.5167140000000003],
    [47.144305000000003, 9.5164550000000006],
    [47.144471000000003, 9.5161350000000002],
    [47.144554999999997, 9.5159699999999994],
    [47.144589000000003, 9.5159059999999993],
    [47.144623000000003, 9.5158450000000006],
    [47.144703999999997, 9.5157050000000005],
    [47.14481, 9.5155370000000001],
    [47.144869, 9.5154460000000007],
    [47.144981000000001, 9.5152780000000003],
    [47.145099999999999, 9.5151020000000006],
    [47.145221999999997, 9.5149299999999997],
    [47.145229999999998, 9.5149179999999998],
    [47.145319000000001, 9.5147940000000002],
    [47.145443999999998, 9.5146280000000001],
    [47.145505999999997, 9.5145499999999998],
    [47.145567999999997, 9.5144749999999991],
    [47.145657, 9.5143760000000004],
    [47.145766999999999, 9.5142609999999994],
    [47.145879999999998, 9.5141489999999997],
    [47.145992999999997, 9.5140440000000002],
    [47.146298999999999, 9.5137660000000004],
    [47.146498000000001, 9.5135909999999999],
    [47.146707999999997, 9.5134109999999996],
    [47.146777999999998, 9.5133539999999996],
    [47.146849000000003, 9.5132999999999992],
    [47.146988999999998, 9.5131960000000007],
    [47.147233999999997, 9.5130239999999997],
    [47.147298999999997, 9.5129819999999992],
    [47.147438000000001, 9.5128959999999996],
    [47.147562999999998, 9.5128240000000002],
    [47.147677000000002, 9.5127620000000004],
    [47.147730000000003, 9.5127349999999993],
    [47.147790999999998, 9.5127039999999994],
    [47.147939999999998, 9.5126310000000007],
    [47.148088999999999, 9.5125589999999995],
    [47.148204999999997, 9.5125100000000007],
    [47.148318000000003, 9.5124700000000004],
    [47.148547999999998, 9.5123870000000004],
    [47.148814999999999, 9.5122890000000009],
    [47.148879999999998, 9.5122630000000008],
    [47.149059000000001, 9.5121959999999994],
    [47.149239999999999, 9.512124],
    [47.149574999999999, 9.5119889999999998],
    [47.149681999999999, 9.5119450000000008],
    [47.149715999999998, 9.5119299999999996],
    [47.149852000000003, 9.5118709999999993],
    [47.149872999999999, 9.5118609999999997],
    [47.149997999999997, 9.5118030000000005],
    [47.150103000000001, 9.5117530000000006],
    [47.150181000000003, 9.5117139999999996],
    [47.150249000000002, 9.5116800000000001],
    [47.150289999999998, 9.5116589999999999],
    [47.15034, 9.5116329999999998],
    [47.150460000000002, 9.5115700000000007],
    [47.150620000000004, 9.5114789999999996],
    [47.150700999999998, 9.5114339999999995],
    [47.150781000000002, 9.511393],
    [47.150877000000001, 9.5113500000000002],
    [47.150973999999998, 9.5113140000000005],
    [47.151035999999998, 9.5112939999999995],
    [47.151097, 9.5112760000000005],
    [47.151217000000003, 9.5112450000000006],
    [47.151316000000001, 9.5112240000000003],
    [47.151395000000001, 9.5112089999999991],
    [47.151536, 9.5111779999999992],
    [47.151625000000003, 9.5111589999999993],
    [47.152002000000003, 9.511082],
    [47.152242999999999, 9.5110259999999993],
    [47.152552999999997, 9.5109630000000003],
    [47.152718, 9.5109279999999998],
    [47.152861999999999, 9.5108960000000007],
    [47.153683000000001, 9.5107040000000005],
    [47.153711000000001, 9.5106979999999997],
    [47.153782, 9.5106819999999992],
    [47.153962999999997, 9.5106420000000007],
    [47.154350000000001, 9.5105649999999997],
    [47.154667000000003, 9.5104959999999998],
    [47.154791000000003, 9.5104679999999995],
    [47.154865999999998, 9.5104509999999998],
    [47.154941999999998, 9.5104380000000006],
    [47.155016000000003, 9.5104249999999997],
    [47.155124000000001, 9.5104009999999999],
    [47.155223999999997, 9.5103760000000008],
    [47.155321000000001, 9.510351],
    [47.155369999999998, 9.5103369999999998],
    [47.155417999999997, 9.5103220000000004],
    [47.155487000000001, 9.5102949999999993],
    [47.155548000000003, 9.5102709999999995],
    [47.155608000000001, 9.5102469999999997],
    [47.155687, 9.5102089999999997],
    [47.155766999999997, 9.5101680000000002],
    [47.155856999999997, 9.5101189999999995],
    [47.155918, 9.5100820000000006],
    [47.15598, 9.5100429999999996],
    [47.156002999999998, 9.5100269999999991],
    [47.156122000000003, 9.5099409999999995],
    [47.156286000000001, 9.5098389999999995],
    [47.156365000000001, 9.5097950000000004],
    [47.156446000000003, 9.5097590000000007],
    [47.15654, 9.5097190000000005],
    [47.156632999999999, 9.5096860000000003],
    [47.156699000000003, 9.5096640000000008],
    [47.156767000000002, 9.5096500000000006],
    [47.156841999999997, 9.5096410000000002],
    [47.156917, 9.5096340000000001],
    [47.156995000000002, 9.5096260000000008],
    [47.157071999999999, 9.5096170000000004],
    [47.157153000000001, 9.5096109999999996],
    [47.157235, 9.5096059999999998],
    [47.157322000000001, 9.5096030000000003],
    [47.157404, 9.5096030000000003],
    [47.157482999999999, 9.5096050000000005],
    [47.157597000000003, 9.5096059999999998],
    [47.157635999999997, 9.5096070000000008],
    [47.157646999999997, 9.5096080000000001],
    [47.157792000000001, 9.5096080000000001],
    [47.157871, 9.5096070000000008],
    [47.157964, 9.5096030000000003],
    [47.157994000000002, 9.509601],
    [47.158102999999997, 9.5095890000000001],
    [47.158150999999997, 9.5095829999999992],
    [47.158231999999998, 9.5095700000000001],
    [47.158304000000001, 9.5095530000000004],
    [47.158375999999997, 9.5095349999999996],
    [47.158454999999996, 9.5095130000000001],
    [47.158541, 9.5094849999999997],
    [47.158752, 9.5094169999999991],
    [47.158898000000001, 9.5093669999999992],
    [47.159154999999998, 9.5092850000000002],
    [47.159395000000004, 9.5092130000000008],
    [47.159540999999997, 9.5091710000000003],
    [47.159781000000002, 9.5091040000000007],
    [47.160021999999998, 9.5090400000000006],
    [47.160167999999999, 9.5090039999999991],
    [47.160325, 9.5089659999999991],
    [47.160522999999998, 9.5089199999999998],
    [47.160739, 9.5088720000000002],
    [47.160777000000003, 9.5088650000000001],
    [47.160845000000002, 9.5088519999999992],
    [47.160890000000002, 9.5088419999999996],
    [47.160929000000003, 9.5088340000000002],
    [47.160983000000002, 9.5088240000000006],
    [47.161026999999997, 9.5088150000000002],
    [47.161074999999997, 9.5088050000000006],
    [47.161188000000003, 9.5087849999999996],
    [47.161239000000002, 9.5087759999999992],
    [47.161394000000001, 9.5087480000000006],
    [47.161509000000002, 9.5087279999999996],
    [47.161625999999998, 9.5087069999999994],
    [47.161799000000002, 9.5086759999999995],
    [47.161994999999997, 9.5086440000000003],
    [47.162126999999998, 9.5086250000000003],
    [47.162350000000004, 9.5085999999999995],
    [47.162457000000003, 9.5085899999999999],
    [47.162702000000003, 9.5085689999999996],
    [47.162747000000003, 9.5085650000000008],
    [47.162782999999997, 9.5085610000000003],
    [47.163086, 9.5085329999999999],
    [47.163173, 9.5085259999999998],
    [47.163258999999996, 9.5085230000000003],
    [47.163297999999998, 9.5085230000000003],
    [47.163336000000001, 9.5085239999999995],
    [47.163415999999998, 9.5085320000000007],
    [47.163466, 9.50854],
    [47.163528999999997, 9.5085510000000006],
    [47.163597000000003, 9.5085619999999995],
    [47.163682000000001, 9.5085999999999995],
    [47.163735000000003, 9.5086069999999996],
    [47.163814000000002, 9.5086110000000001],
    [47.163879999999999, 9.5086139999999997],
    [47.163939999999997, 9.5086220000000008],
    [47.164000999999999, 9.5086329999999997],
    [47.164347999999997, 9.5087060000000001],
    [47.164434999999997, 9.5087240000000008],
    [47.164496999999997, 9.5087349999999997],
    [47.164569999999998, 9.5087449999999993],
    [47.164599000000003, 9.5087460000000004],
    [47.164658000000003, 9.5087489999999999],
    [47.164707999999997, 9.5087530000000005],
    [47.164765000000003, 9.5087600000000005],
    [47.164824000000003, 9.5087709999999994],
    [47.165129, 9.5088310000000007],
    [47.165204000000003, 9.5088460000000001],
    [47.165384000000003, 9.5088969999999993],
    [47.165469999999999, 9.5089210000000008],
    [47.165551999999998, 9.5089469999999992],
    [47.165627999999998, 9.5089749999999995],
    [47.165680000000002, 9.5089980000000001],
    [47.165731999999998, 9.5090229999999991],
    [47.165818999999999, 9.5090699999999995],
    [47.165956999999999, 9.5091520000000003],
    [47.165933000000003, 9.5092269999999992],
    [47.165889, 9.5093700000000005],
    [47.165844, 9.5095089999999995],
    [47.165813, 9.5095960000000002],
    [47.165778000000003, 9.5096880000000006],
    [47.165709, 9.5098739999999999],
    [47.165737999999997, 9.5098970000000005],
    [47.165827, 9.5099630000000008],
    [47.165979999999998, 9.5100650000000009]
  ],
  "maneuvers": [
    {
      "type": "start",
      "instruction": "Drive east on Adlerkreisel.",
      "distanceM": 33,
      "durationS": 4.3799999999999999,
      "beginShapeIndex": 0,
      "endShapeIndex": 12,
      "bearingBeforeDeg": null,
      "bearingAfterDeg": 83,
      "engineType": 3,
      "streetNames": ["Adlerkreisel"]
    },
    {
      "type": "roundabout_exit",
      "instruction": "Exit the roundabout toward Feldkirch/Schaan.",
      "distanceM": 3047,
      "durationS": 220.523,
      "beginShapeIndex": 12,
      "endShapeIndex": 235,
      "bearingBeforeDeg": 319,
      "bearingAfterDeg": 334,
      "engineType": 27,
      "streetNames": ["Herrengasse"]
    },
    {
      "type": "turn_right",
      "instruction": "Turn right onto Schulgass.",
      "distanceM": 61,
      "durationS": 6.9619999999999997,
      "beginShapeIndex": 235,
      "endShapeIndex": 241,
      "bearingBeforeDeg": 22,
      "bearingAfterDeg": 115,
      "engineType": 10,
      "streetNames": ["Schulgass"]
    },
    {
      "type": "turn_left",
      "instruction": "Turn left.",
      "distanceM": 33,
      "durationS": 10.282999999999999,
      "beginShapeIndex": 241,
      "endShapeIndex": 244,
      "bearingBeforeDeg": 119,
      "bearingAfterDeg": 28,
      "engineType": 15,
      "streetNames": []
    },
    {
      "type": "arrive",
      "instruction": "Your destination is on the left.",
      "distanceM": 0,
      "durationS": 0,
      "beginShapeIndex": 244,
      "endShapeIndex": 244,
      "bearingBeforeDeg": 24,
      "bearingAfterDeg": null,
      "engineType": 6,
      "streetNames": []
    }
  ],
  "diagnostics": [
  ]
}

README.md

## Licensing

- origin: 47.1410, 9.5209
- destination: 47.1660, 9.5100
- distance: approximately 3174 m
- duration: approximately 242.149 s